{
  "schemaVersion": 1,
  "id": "g9-2-1b",
  "title": "2-1 點、直線與圓之間的位置關係（2）點、直線與圓、切線",
  "description": "拖曳點 P、拉動直線，用「到圓心的距離」和半徑 r 比大小，判斷點在圓內／圓上／圓外、直線不相交／相切／割線；理解切線垂直過切點的半徑，再用畢氏定理求切線段長。例題與隨堂附課本截圖，解題過程逐步呈現，隨堂改為可即時批改的 IRS。",
  "subject": "數學・九年級 2-1",
  "duration": 45,
  "objectives": [
    "能比較 OP 與 r，判斷點與圓的位置關係",
    "能比較圓心到直線的距離 d 與 r，判斷直線與圓的交點數（不相交、切線、割線）",
    "能說明圓心與切點的連線垂直切線，並用畢氏定理求切線段長或半徑"
  ],
  "slides": [
    {
      "id": "b-warmup",
      "phase": "提取練習",
      "eyebrow": "01 / 先想起距離與畢氏定理",
      "title": "點到直線的距離、畢氏定理",
      "body": "七下學過：點到直線的距離是「垂直線段」的長；八上學過畢氏定理。這節課兩個都會用到，先暖身三題。",
      "source": "銜接課本 p.85 Are You Ready（七下點到直線距離、八上畢氏定理）",
      "interactive": {
        "view": {
          "xMin": 0,
          "xMax": 20,
          "yMin": 0,
          "yMax": 11,
          "aspect": "equal"
        },
        "shapes": [
          {
            "type": "segment",
            "points": [
              [
                0.6,
                2.4
              ],
              [
                10,
                2.4
              ]
            ],
            "color": "#1f2a56",
            "width": 2
          },
          {
            "type": "text",
            "x": 10.2,
            "y": 2.9,
            "text": "L",
            "size": 15,
            "color": "#1f2a56"
          },
          {
            "type": "segment",
            "points": [
              [
                3.6,
                8.6
              ],
              [
                3.6,
                2.4
              ]
            ],
            "color": "#e5484d",
            "width": 3
          },
          {
            "type": "segment",
            "points": [
              [
                3.6,
                8.6
              ],
              [
                8.2,
                2.4
              ]
            ],
            "color": "#6b7394",
            "width": 2,
            "dash": true
          },
          {
            "type": "segment",
            "points": [
              [
                3.6,
                2.75
              ],
              [
                3.95,
                2.75
              ]
            ],
            "color": "#1f2a56",
            "width": 1.4
          },
          {
            "type": "segment",
            "points": [
              [
                3.95,
                2.4
              ],
              [
                3.95,
                2.75
              ]
            ],
            "color": "#1f2a56",
            "width": 1.4
          },
          {
            "type": "point",
            "x": 3.6,
            "y": 8.6,
            "color": "#1f2a56"
          },
          {
            "type": "text",
            "x": 3.2,
            "y": 9.1,
            "text": "O",
            "size": 15,
            "color": "#1f2a56"
          },
          {
            "type": "text",
            "x": 3.3,
            "y": 1.8,
            "text": "P",
            "size": 15,
            "color": "#1f2a56"
          },
          {
            "type": "text",
            "x": 8.4,
            "y": 1.8,
            "text": "Q",
            "size": 15,
            "color": "#1f2a56"
          },
          {
            "type": "text",
            "x": 14.8,
            "y": 7.6,
            "text": "O 到 L 的距離 ＝ $\\overline{OP}$",
            "size": 19,
            "color": "#e5484d"
          },
          {
            "type": "text",
            "x": 14.8,
            "y": 5.8,
            "text": "（垂直線段最短）",
            "size": 16,
            "color": "#4b5478"
          },
          {
            "type": "text",
            "x": 14.8,
            "y": 3.8,
            "text": "$a^{2}+b^{2}=c^{2}$",
            "size": 22,
            "color": "#5a3fd6"
          }
        ],
        "caption": "垂直線段 OP 比斜線段 OQ 短；直角三角形用畢氏定理"
      },
      "activity": {
        "id": "b-warmup-q",
        "type": "numeric",
        "prompt": "暖身：直接寫出答案",
        "items": [
          {
            "prompt": "課本 p.85：AB⊥BC，AB＝9、BC＝12，AC＝？",
            "answer": "15"
          },
          {
            "prompt": "直角三角形斜邊 13、一股 5，另一股＝？",
            "answer": "12"
          },
          {
            "prompt": "坐標平面上 P(6, 8) 到原點 O 的距離＝？",
            "answer": "10"
          }
        ],
        "explanation": "(1) √(9²＋12²)＝15。(2) √(13²－5²)＝12。(3) √(6²＋8²)＝10。"
      },
      "notes": "Are You Ready：O 到 L 的距離是 OP（垂直線段），不是 OQ。"
    },
    {
      "id": "b-predict",
      "phase": "預測",
      "eyebrow": "02 / 先猜",
      "title": "直線離圓心多遠時，剛好碰到圓？",
      "body": "一條直線慢慢靠近圓。當「圓心到直線的距離」剛好等於半徑時，直線和圓有幾個交點？先猜，等一下拖拉驗證。",
      "source": "對應課本 p.93 的問題（自編題）",
      "visual": "cards",
      "activity": {
        "id": "b-predict-q",
        "type": "single",
        "prompt": "圓心到直線的距離＝半徑時，直線和圓有幾個交點？",
        "options": [
          "0 個",
          "1 個",
          "2 個",
          "不一定"
        ],
        "correct": [
          1
        ],
        "explanation": "距離等於半徑時，垂足 P 剛好在圓上，直線上其他點都在圓外，只有 1 個交點（相切）。"
      },
      "notes": "先公布統計、不公布答案，保留疑問到直線的具體操作頁。"
    },
    {
      "id": "b-point",
      "phase": "具體操作",
      "eyebrow": "03 / 拖曳點 P",
      "title": "點在圓內、圓上，還是圓外？",
      "body": "拖曳點 P，看 OP 和半徑 r 的大小關係。圓把平面分成三部分：內部、圓周、外部。",
      "source": "對應課本 2-1 p.92（題目數字同課本）",
      "figures": [
        {
          "src": "g9-2-1/point-circle.png",
          "alt": "課本 p.92 點與圓的位置關係"
        }
      ],
      "interactive": {
        "view": {
          "xMin": -6.8,
          "xMax": 16.5,
          "yMin": -6.6,
          "yMax": 6.6,
          "aspect": "equal",
          "grid": 1
        },
        "points": [
          {
            "id": "P",
            "x": 2,
            "y": 1,
            "snap": 1,
            "label": "P",
            "minX": -6,
            "maxX": 6,
            "minY": -6,
            "maxY": 6
          }
        ],
        "shapes": [
          {
            "type": "circle",
            "x": 0,
            "y": 0,
            "r": 5,
            "color": "#e5484d",
            "width": 2.4,
            "fill": "rgba(255,201,60,.22)"
          },
          {
            "type": "segment",
            "points": [
              [
                0,
                0
              ],
              [
                5,
                0
              ]
            ],
            "color": "#6b7394",
            "width": 1.6,
            "dash": true
          },
          {
            "type": "text",
            "x": 2.5,
            "y": 0.45,
            "text": "r＝5",
            "size": 13,
            "color": "#4b5478"
          },
          {
            "type": "segment",
            "points": [
              [
                0,
                0
              ],
              [
                "Px",
                "Py"
              ]
            ],
            "color": "#2f80ed",
            "width": 3
          },
          {
            "type": "point",
            "x": 0,
            "y": 0,
            "color": "#1f2a56"
          },
          {
            "type": "text",
            "x": -0.45,
            "y": -0.45,
            "text": "O",
            "size": 15,
            "color": "#1f2a56"
          },
          {
            "type": "text",
            "x": 11.4,
            "y": 5.2,
            "text": "OP ＝ {round(sqrt(Px^2+Py^2)*100)/100}",
            "size": 18,
            "color": "#2f80ed"
          },
          {
            "type": "text",
            "x": 11.4,
            "y": 3.9,
            "text": "半徑 r ＝ 5",
            "size": 18,
            "color": "#1f2a56"
          },
          {
            "type": "text",
            "x": 11.4,
            "y": 2.2,
            "text": "OP ＜ r：P 在圓內",
            "size": 19,
            "color": "#16824f",
            "show": "Px^2+Py^2<25"
          },
          {
            "type": "text",
            "x": 11.4,
            "y": 2.2,
            "text": "OP ＝ r：P 在圓上",
            "size": 19,
            "color": "#e5484d",
            "show": "Px^2+Py^2==25"
          },
          {
            "type": "text",
            "x": 11.4,
            "y": 2.2,
            "text": "OP ＞ r：P 在圓外",
            "size": 19,
            "color": "#5a3fd6",
            "show": "Px^2+Py^2>25"
          }
        ],
        "readouts": [
          {
            "label": "OP ≈",
            "expr": "sqrt(Px^2+Py^2)",
            "digits": 2
          },
          {
            "label": "OP － r ≈",
            "expr": "sqrt(Px^2+Py^2)-5",
            "digits": 2
          }
        ],
        "caption": "點和圓的位置，只要比較「點到圓心的距離 OP」和「半徑 r」"
      },
      "activity": {
        "id": "b-point-q",
        "type": "manipulate",
        "prompt": "把 P 拖到圓上，但不要放在水平或鉛直的方向上（提示：3、4、5），再按「送出我的操作」。",
        "check": "Px^2+Py^2==25 && Px*Py!=0",
        "record": [
          "Px",
          "Py"
        ],
        "explanation": "例如 P(3, 4)：OP＝√(3²＋4²)＝5＝r，P 在圓上。"
      },
      "notes": "具體操作（CRA）。追問：怎麼不用量就知道 P 在圓上？（用畢氏定理算 OP）"
    },
    {
      "id": "b-point-practice",
      "phase": "隨堂練習",
      "eyebrow": "04 / 點與圓 隨堂",
      "title": "換你判斷：五個點在哪裡？",
      "body": "課本 p.92 隨堂 1、2 合在一起：看課本的圖，選出所有正確的敘述（可複選）。左圖用另一組點示範。",
      "source": "對應課本 2-1 p.92（題目數字同課本）",
      "figures": [
        {
          "src": "g9-2-1/point-practice.png",
          "alt": "課本 p.92 隨堂練習"
        }
      ],
      "interactive": {
        "view": {
          "xMin": 0,
          "xMax": 20,
          "yMin": 0,
          "yMax": 11,
          "aspect": "equal"
        },
        "shapes": [
          {
            "type": "circle",
            "x": 5,
            "y": 5.6,
            "r": 3,
            "color": "#e5484d",
            "width": 2.4,
            "fill": "rgba(255,201,60,.22)",
            "focus": [
              0,
              1,
              2,
              3
            ]
          },
          {
            "type": "point",
            "x": 5,
            "y": 5.6,